{
  "$schema": "http://json-schema.org/draft-07/schema#",
  "title": "Metrics API Contract",
  "type": "object",
  "required": ["success", "message", "data", "timestamp", "requestId"],
  "properties": {
    "success": { "type": "boolean", "const": true },
    "message": { "type": "string" },
    "timestamp": { "type": "string" },
    "requestId": { "type": "string" },
    "data": {
      "type": "object",
      "required": ["benchmarkSummary", "analytics"],
      "properties": {
        "benchmarkSummary": { "type": "object" },
        "analytics": { "type": "object" }
      }
    }
  }
}
