{
  "success": true,
  "message": "Retrieved system benchmark statistics and analytics",
  "data": {
    "success": true,
    "benchmarkSummary": {
      "usersTested": 12,
      "averageLatencyMs": 3.35,
      "recommendationsPerSecond": 298.9,
      "cacheStats": {
        "totalRequests": 24,
        "hits": 12,
        "misses": 12,
        "hitRatePercent": 50.0
      }
    },
    "analytics": {
      "averageRecommendationScore": 85.5,
      "categoryPopularity": {
        "tshirt": 45,
        "jeans": 30,
        "jacket": 25
      }
    }
  },
  "timestamp": "2026-07-31T23:00:00Z",
  "requestId": "e5f6a7b8-9c0d-1e2f-3a4b-5c6d7e8f9a0b"
}
